{
  "$schema": "https://json-schema.org/draft/2020-12/schema",
  "$id": "jobs.schema.json",
  "title": "jobs authoring hints",
  "type": "array",
  "items": {
    "type": "object",
    "additionalProperties": false,
    "properties": {
      "id": {
        "type": "string",
        "pattern": "^[a-z][a-z0-9_]{0,63}$"
      },
      "name": {
        "type": "string",
        "maxLength": 120
      },
      "careerId": {
        "type": "string",
        "maxLength": 120
      },
      "baseEarnings": {
        "type": "string",
        "pattern": "^(0|[1-9][0-9]{0,59})$"
      },
      "maxEarnings": {
        "type": "string",
        "pattern": "^(0|[1-9][0-9]{0,59})$"
      },
      "hungerStrain": {
        "type": "integer",
        "minimum": 0,
        "maximum": 10000000
      },
      "sanityCost": {
        "type": "integer",
        "minimum": 0,
        "maximum": 10000000
      },
      "requirements": {
        "type": "object",
        "additionalProperties": false,
        "required": [
          "itemIds",
          "qualificationIds",
          "familyExperienceDays"
        ],
        "properties": {
          "itemIds": {
            "type": "array",
            "items": {
              "type": "string"
            },
            "maxItems": 512,
            "uniqueItems": true
          },
          "qualificationIds": {
            "type": "array",
            "items": {
              "type": "string"
            },
            "maxItems": 512,
            "uniqueItems": true
          },
          "familyExperienceDays": {
            "type": "integer",
            "minimum": 0,
            "maximum": 10000000
          }
        }
      },
      "available": {
        "type": "boolean"
      },
      "icon": {
        "enum": [
          "briefcase",
          "school",
          "home",
          "car",
          "bag",
          "flag",
          "heart",
          "watch",
          "shirt",
          "music",
          "plane",
          "bank"
        ]
      }
    },
    "required": [
      "available",
      "baseEarnings",
      "careerId",
      "hungerStrain",
      "icon",
      "id",
      "maxEarnings",
      "name",
      "requirements",
      "sanityCost"
    ]
  },
  "maxItems": 512
}
